{
  "schemaVersion": 1,
  "updated": "2026-09-15",
  "coordinatorThreadId": "01a09aba-b390-7650-a5d0-8d62f3066d29",
  "planningThreadId": "01a0a064-04e7-7252-becf-c54cdc07819d",
  "planningBranch": "codex/remplanner-adoption-plan",
  "baselineSha": "836399775e91ccf05e44959b6bea9960605defbb",
  "baselinePr": 209,
  "integrationBranch": "main",
  "finalStackTip": "b5c4ccda08d98e0e966941250de90544948d2e62",
  "planningPr": "https://github.com/Luis85/renovation-planner/pull/215",
  "dispatchAllowed": true,
  "dispatchBlocker": "",
  "maxConcurrentCodingTasks": 3,
  "verificationOwner": "01a0a064-04e7-7252-becf-c54cdc07819d",
  "machineLease": "adoption-coordinator-exclusive",
  "reservedTasks": [
    {
      "threadId": "01a0a05e-1ed9-7541-969c-4d71e6ee7cee",
      "branch": "codex/usability-astra-wall-tool-polish",
      "status": "delivered",
      "scope": "Delivered #212 and #213: wall drawing/thickness, independent A/B depths, initial-write admission and opening host/frame clipping. Opening direct controls remain R01."
    },
    {
      "threadId": "01a0a060-b9d8-70c2-892f-ce30ba026b08",
      "branch": "codex/usability-astra-item-colors",
      "status": "delivered",
      "scope": "Delivered #214 at b5c4ccda: single Item/asset color via schema 14; default plus six presets, shared menu/Inspector command."
    }
  ],
  "reservedPathPrefixes": [
    "src/presentation/editor/structure",
    "src/presentation/editor/selection",
    "src/presentation/editor/elements",
    "src/domain/spatial",
    "src/application/commands/spatial",
    "src/infrastructure/persistence",
    "src/infrastructure/obsidian/repositories",
    "src/presentation/i18n/locales",
    "styles"
  ],
  "reservedExactPaths": [
    "src/presentation/editor/PlanCanvas.vue",
    "src/presentation/editor/runtime.ts"
  ],
  "packets": [
    {
      "id": "R00",
      "title": "Reconcile final stack and admit packets",
      "kind": "coordination",
      "model": "gpt-6-astra",
      "reasoning": "high",
      "status": "accepted",
      "dependsOn": [],
      "baseSha": "b5c4ccda08d98e0e966941250de90544948d2e62",
      "branch": "codex/remplanner-adoption-plan",
      "threadId": "01a0a064-04e7-7252-becf-c54cdc07819d",
      "ownedExistingPaths": [
        "docs/user-experience/remplanner-adoption/parallel-delivery/dispatch.json",
        "docs/user-experience/remplanner-adoption/implementation-plan.md",
        "docs/user-experience/remplanner-adoption/parallel-delivery/prompts.md"
      ],
      "ownedNewPaths": [
        "docs/user-experience/remplanner-adoption/parallel-delivery/receipts/R00.md"
      ],
      "targetedTests": [],
      "blockers": []
    },
    {
      "id": "R01",
      "title": "Direct opening size and swing",
      "kind": "coding",
      "model": "gpt-5.6-terra",
      "reasoning": "high",
      "status": "active",
      "dependsOn": [
        "R00"
      ],
      "baseSha": "bb149cd4a2f38936be9718d511b7d90164cb1847",
      "branch": "codex/remplanner-r01",
      "threadId": "01a0a433-a8e1-7213-8054-25c806b53729",
      "ownedExistingPaths": [
        "src/presentation/editor/PlanCanvas.vue",
        "src/presentation/editor/runtime.ts",
        "src/presentation/editor/structure/StructurePlanActions.vue",
        "src/presentation/editor/selection/useCanvasMenuActions.ts",
        "src/presentation/editor/structure/structureActions.ts",
        "src/presentation/editor/structure/openingMove.ts",
        "src/presentation/editor/structure/OpeningMoveTool.ts",
        "src/presentation/editor/structure/OpeningSwingFields.vue",
        "src/presentation/editor/structure/OpeningDetails.vue",
        "src/presentation/i18n/locales/en/structure.ts",
        "src/presentation/i18n/locales/de/structure.ts",
        "styles/index.css",
        "src/presentation/editor/selection/CanvasContextMenu.vue",
        "src/presentation/editor/selection/CanvasMenuList.vue",
        "src/presentation/editor/structure/StructureEditForm.vue",
        "src/presentation/editor/tools/editor-tool.ts",
        "src/presentation/editor/tools/registerEditorTools.ts",
        "docs/using-plan-editor.md",
        "tests/harness/referenceWorkspace.ts",
        "src/presentation/editor/PlanEditorRoot.vue",
        "src/presentation/editor/shell/ResponsiveEditorShell.vue"
      ],
      "ownedNewPaths": [
        "src/presentation/editor/structure/openingDirectActions.ts",
        "src/presentation/editor/structure/openingDirectDraft.ts",
        "src/presentation/editor/structure/openingDirectLayout.ts",
        "src/presentation/editor/structure/openingDirectCamera.ts",
        "src/presentation/editor/structure/OpeningDirectNarrow.vue",
        "tests/harness/openingDirectWorkspace.ts",
        "tests/harness/opening-direct-responsive.html",
        "src/presentation/editor/structure/OpeningDirectPanel.vue",
        "styles/editor-opening-direct.css",
        "tests/presentation/editor/remplanner-opening-direct.test.ts",
        "docs/user-experience/remplanner-adoption/parallel-delivery/receipts/R01.md"
      ],
      "targetedTests": [
        "tests/presentation/editor/openingMove.test.ts",
        "tests/presentation/editor/openingUsability.test.ts",
        "tests/presentation/editor/openingSwingQueuedInput.test.ts",
        "tests/presentation/editor/openingFreshPersistence.test.ts",
        "tests/presentation/editor/structureActions.test.ts",
        "tests/presentation/editor/usability/i11-opening-details.test.ts",
        "tests/presentation/editor/usability/i14-mode-input-guard.test.ts",
        "tests/presentation/editor/wallSideIntegration.test.ts",
        "tests/presentation/editor/itemColors.test.ts"
      ],
      "blockers": []
    },
    {
      "id": "R02",
      "title": "Drawing and keyboard help",
      "kind": "coding",
      "model": "gpt-5.6-luna",
      "reasoning": "high",
      "status": "queued",
      "dependsOn": [
        "R01"
      ],
      "baseSha": null,
      "branch": "codex/remplanner-r02",
      "threadId": null,
      "ownedExistingPaths": [
        "src/presentation/editor/shell/EditorViewMenu.vue",
        "src/presentation/i18n/locales/en/editor.ts",
        "src/presentation/i18n/locales/de/editor.ts",
        "styles/index.css",
        "docs/using-plan-editor.md"
      ],
      "ownedNewPaths": [
        "src/presentation/editor/shell/EditorDrawingHelp.vue",
        "styles/editor-drawing-help.css",
        "tests/presentation/editor/remplanner-drawing-help.test.ts",
        "docs/user-experience/remplanner-adoption/parallel-delivery/receipts/R02.md"
      ],
      "targetedTests": [
        "tests/presentation/editor/shell/editorViewMenuPopOut.test.ts",
        "tests/presentation/editor/inputInteractions.test.ts",
        "tests/presentation/editor/keyboardNudge.test.ts",
        "tests/presentation/editor/usability/i14-mode-input-guard.test.ts"
      ],
      "blockers": [
        "predecessor-green-ci"
      ]
    },
    {
      "id": "R03",
      "title": "Selection measurement visibility",
      "kind": "coding",
      "model": "gpt-5.6-terra",
      "reasoning": "high",
      "status": "queued",
      "dependsOn": [
        "R02"
      ],
      "baseSha": null,
      "branch": "codex/remplanner-r03",
      "threadId": null,
      "ownedExistingPaths": [
        "src/presentation/editor/shell/EditorViewMenu.vue",
        "src/presentation/editor/PlanEditorContext.ts",
        "src/presentation/editor/PlanEditorRoot.vue",
        "src/presentation/stores/WorkspaceStore.ts",
        "src/infrastructure/obsidian/plugin-data/EditorViewPreferencesStore.ts",
        "src/presentation/editor/resize/RoomDimensionLabels.vue",
        "src/presentation/editor/resize/useDimensionObstacles.ts",
        "src/presentation/editor/selection/WallCanvasActions.vue",
        "src/presentation/i18n/locales/en/editor.ts",
        "src/presentation/i18n/locales/de/editor.ts"
      ],
      "ownedNewPaths": [
        "tests/presentation/editor/remplanner-measurement-visibility.test.ts",
        "docs/user-experience/remplanner-adoption/parallel-delivery/receipts/R03.md"
      ],
      "targetedTests": [
        "tests/infrastructure/obsidian/plugin-data/editorViewPreferencesStore.test.ts",
        "tests/presentation/editor/roomDimensionInline.test.ts",
        "tests/presentation/editor/roomDimensionLifecycle.test.ts",
        "tests/presentation/editor/dimensionObstacles.test.ts",
        "tests/presentation/editor/usability/i10-dimensions-feedback.test.ts",
        "tests/presentation/editor/shell/editorViewMenuPopOut.test.ts"
      ],
      "blockers": [
        "predecessor-green-ci"
      ]
    },
    {
      "id": "R04",
      "title": "Astra integration, UI fidelity, code, main-refresh and native review",
      "kind": "integration",
      "model": "gpt-6-astra",
      "reasoning": "high",
      "status": "queued",
      "dependsOn": [
        "R03"
      ],
      "baseSha": null,
      "branch": "codex/remplanner-r04",
      "threadId": null,
      "ownedExistingPaths": [
        "docs/user-experience/remplanner-adoption/parallel-delivery/dispatch.json",
        "docs/user-experience/remplanner-adoption/validation-plan.md",
        "docs/using-plan-editor.md"
      ],
      "ownedNewPaths": [
        "docs/user-experience/remplanner-adoption/parallel-delivery/receipts/R04.md",
        "docs/user-experience/remplanner-adoption/evidence/integration"
      ],
      "targetedTests": [],
      "blockers": [
        "all-coding-receipts",
        "exclusive-heavy-lease"
      ]
    },
    {
      "id": "R05",
      "title": "Define local handoff and print contract",
      "kind": "design",
      "model": "gpt-6-astra",
      "reasoning": "high",
      "status": "deferred",
      "dependsOn": [
        "R04"
      ],
      "baseSha": null,
      "branch": "codex/remplanner-r05",
      "threadId": null,
      "ownedExistingPaths": [
        "docs/user-experience/remplanner-adoption/adoption-matrix.md"
      ],